{
  "id": "nl-erasmus-international-business-administration",
  "institution": "nl-erasmus",
  "name": "International Business Administration",
  "credential": {
    "comparableLevel": "bachelor",
    "structure": "standard",
    "localTitle": "Bachelor of Science",
    "abbreviation": "BSc",
    "sector": {
      "local": "universiteit",
      "en": "research university",
      "kind": "research"
    },
    "eqf": 6,
    "ects": 180,
    "years": 3
  },
  "field": {
    "primary": "business",
    "keywords": [
      "Management",
      "Organisation",
      "Strategy"
    ]
  },
  "summary": "The large English-taught business degree at Rotterdam School of Management: three years of organisation, marketing, finance and strategy taught to a cohort that is majority international, in a school that is accredited on all three of the international business-school systems. The competition is entirely front-loaded — a quarter of your selection score is three motivation questions you answer in January.",
  "links": {
    "official": "https://www.eur.nl/en/bachelor/bachelor-international-business-administration",
    "admissions": "https://www.rsm.nl/education/bachelor/bsc-international-business-administration-iba/admission-application/"
  },
  "evidence": [
    "ev-eur-nl-iba-selection",
    "ev-rsm-nl-iba-ib"
  ],
  "meta": {
    "schemaVersion": "1.0",
    "dataAsOf": "2026-09-23"
  }
}
