{
  "id": "dk-cbs-international-business-and-politics",
  "institution": "dk-cbs",
  "name": "International Business and Politics",
  "credential": {
    "comparableLevel": "bachelor",
    "structure": "standard",
    "localTitle": "Bachelor (BSc)",
    "localTitleEn": "Bachelor of Science",
    "abbreviation": "BSc",
    "sector": {
      "local": "universitet",
      "en": "university",
      "kind": "research"
    },
    "eqf": 6,
    "ects": 180,
    "years": 3,
    "title": "BSc",
    "level": "bachelor"
  },
  "field": {
    "primary": "computing",
    "keywords": [
      "Business & economics"
    ]
  },
  "summary": "Half political science, half economics and mathematics, built around the question of how firms operate when regulation, trade policy and geopolitics keep moving. Roughly 40 per cent politics, 40 per cent economics and mathematics, with smaller blocks on trade and logistics and on organisation. Pick it if you would be equally happy reading a trade agreement and a balance sheet.",
  "links": {
    "official": "https://www.cbs.dk/en/study-programmes/bachelor-programmes/bsc-international-business-and-politics"
  },
  "evidence": [
    "ev-cbs-dk-bevf6j"
  ],
  "meta": {
    "schemaVersion": "1.0",
    "dataAsOf": "2026-09-22"
  }
}
