{
  "id": "nl-breda-uas-hotel-management",
  "institution": "nl-breda-uas",
  "name": "Hotel Management",
  "credential": {
    "comparableLevel": "bachelor",
    "structure": "standard",
    "abbreviation": "BBA",
    "sector": {
      "local": "hogeschool",
      "en": "university of applied sciences",
      "kind": "applied"
    },
    "eqf": 6,
    "ects": 240,
    "years": 4
  },
  "field": {
    "primary": "hospitality-tourism",
    "keywords": [
      "Hospitality",
      "Operations",
      "Service management"
    ]
  },
  "summary": "The degree Breda is known for: four years of hotel and hospitality operations taught largely by doing, with placements in the industry and a second modern language alongside English. Admission turns on a motivation letter, an assignment and — for an applicant with a non-Dutch diploma — a personal video message, rather than on your grades.",
  "links": {
    "official": "https://www.buas.nl/en/programmes/hotel-management",
    "admissions": "https://www.buas.nl/en/international-students/admission-and-application/admission-requirements"
  },
  "evidence": [
    "ev-buas-nl-admission",
    "ev-buas-nl-selection-2027"
  ],
  "meta": {
    "schemaVersion": "1.0",
    "dataAsOf": "2026-09-23",
    "notes": [
      "A full IB Diploma is compared by Nuffic to a vwo diploma, and BUas offers a three-year track to applicants whose diploma is comparable to vwo. The standard hbo bachelor recorded on this programme is four years and 240 ECTS; the length of the short track was not established here, so it is not recorded as a credential."
    ]
  }
}
